{
  "$schema": "https://json-schema.org/draft/2020-12/schema",
  "$id": "https://docs.cloudpick.kr/schemas/editorial-packet-v1.json",
  "title": "CloudPick editorial evidence packet (v1)",
  "description": "Draft PR에 첨부되는 근거 패킷의 형식 검증 스키마. 계약 원본(신뢰 기준): froguin/multi-agent-stack@53618d6 docs/architecture/editorial-actions-contract.md. 주의: 이 스키마는 형식(모양)만 검증한다. 형식 통과는 근거 '내용'의 신뢰를 뜻하지 않는다 — tier 판정과 사실 검증은 신뢰된 base-branch 정책(Actions)이 실제 diff·근거로 독립 수행한다. tier_hint·generated_by_llm·writer는 입력 신호일 뿐 최종 판정이 아니며, 이 필드만으로 승인/자동병합/작성자-리뷰어 독립성을 인정하지 않는다. 아래 정규식은 최선의 방어일 뿐이며, 경로 정규화(../ 제거, 심볼릭/제어문자 차단)와 claim 출처 필수 검증은 trusted validator가 최종 담당한다.",
  "type": "object",
  "additionalProperties": false,
  "required": [
    "schema_version",
    "jira_key",
    "policy_action",
    "tier_hint",
    "target_path",
    "changed_paths",
    "claim_ledger"
  ],
  "properties": {
    "schema_version": {
      "description": "패킷 스키마 버전. 현재 1.",
      "const": 1
    },
    "jira_key": {
      "description": "추적 티켓 키. 패킷 파일명(.editorial/packets/<jira_key>.json)과 일치해야 한다.",
      "type": "string",
      "pattern": "^[A-Z][A-Z0-9]+-[0-9]+$",
      "maxLength": 64
    },
    "policy_action": {
      "description": "변경의 정책적 성격. 실제 tier 판정은 Actions가 diff로 재분류한다. link-refresh는 URL 문자열만 교체하는 링크 현행화(사실 불변, claim_ledger 빔 허용)이며 link-refresh-guard가 재구성 매칭으로 증명한다.",
      "type": "string",
      "enum": ["create", "update", "delete", "move", "merge", "split", "link-refresh"]
    },
    "tier_hint": {
      "description": "작성 측이 제안하는 위험 등급 힌트(입력 전용). Actions는 이를 신뢰하지 않고 실제 diff·근거로 재판정하며, 불명확/이견은 상향(escalate)하되 절대 조용히 하향하지 않는다. LLM 생성 편집은 최소 B다.",
      "type": "string",
      "enum": ["A", "B", "C"]
    },
    "tier_reasons": {
      "description": "tier_hint 근거(설명용, 판정 권한 없음).",
      "type": "array",
      "maxItems": 32,
      "items": { "type": "string", "minLength": 1, "maxLength": 512 }
    },
    "target_path": {
      "description": "주 대상 문서 경로(SOT 기준, 보통 ko). 정규식은 제어문자·상위경로(..)·중복 슬래시를 차단하지만, 최종 경로 정규화 검증은 trusted validator가 수행한다.",
      "$ref": "#/$defs/doc_path"
    },
    "changed_paths": {
      "description": "이 PR이 변경하는 문서 경로 전체. Korean SOT가 바뀌면 en·ja 대응 파일이 같은 PR에 있어야 한다(대칭성). 상한 64개.",
      "type": "array",
      "minItems": 1,
      "maxItems": 64,
      "uniqueItems": true,
      "items": { "$ref": "#/$defs/doc_path" }
    },
    "generated_by_llm": {
      "description": "LLM 생성 여부 신호. true는 최소 B로 올리는 신호다. 그러나 false/누락은 인간 작성의 증거가 아니다(diff만으로 작성 주체를 입증할 수 없음). Actions는 신뢰 가능한 공급자/작성 경로와 보수적 정책으로 판정하며, 출처 불명을 A로 낮추지 않는다.",
      "type": "boolean"
    },
    "writer": {
      "description": "작성 모델/공급자 신고. 자기신고이며, 이것만으로 작성자-리뷰어 독립성을 인정하지 않는다. 독립 리뷰는 writer와 구별되는 실제 모델/공급자로 수행되어야 한다.",
      "type": "object",
      "additionalProperties": false,
      "required": ["model", "provider"],
      "properties": {
        "model": { "type": "string", "minLength": 1, "maxLength": 128 },
        "provider": { "type": "string", "minLength": 1, "maxLength": 128 }
      }
    },
    "claim_ledger": {
      "description": "변경된 사실 주장과 공식 출처 목록. quote는 리뷰 보조용이며 독립적 공식 출처 재확인을 대체하지 않는다. 상한 32개. link-refresh(URL-only)는 새 사실 주장이 없어 빈 배열이 정당하다. 주의: 스키마는 source_url 또는 sources 중 최소 하나를 요구하지만, 출처의 실재·내용 일치·status=verified의 진위는 trusted validator가 독립 확인한다(자기신고 verified로 대체 금지).",
      "type": "array",
      "maxItems": 32,
      "items": { "$ref": "#/$defs/claim" }
    },
    "link_refresh": {
      "description": "policy_action=link-refresh 전용. 승인된 old→new URL 매핑과 전체 변경 매니페스트 해시. changed_paths는 스키마상 64개 상한이라 전 문서(수백 개) 분산 변경을 담을 수 없으므로, 전체 경로 목록·매핑·base/head SHA를 해시한 manifest_sha256으로 완전성을 보증하고 CI가 대조한다(council 합의).",
      "type": "object",
      "additionalProperties": false,
      "required": ["url_map", "manifest_sha256", "changed_paths_count"],
      "properties": {
        "url_map": {
          "description": "old→new 절대 URL 매핑(link-refresh-guard가 재구성 매칭에 사용). 상한 512.",
          "type": "object",
          "minProperties": 1,
          "maxProperties": 512,
          "additionalProperties": {
            "type": "string",
            "pattern": "^https?://",
            "maxLength": 2048
          }
        },
        "manifest_sha256": {
          "description": "정렬된 전체 changed_paths + url_map(정렬) + base_sha + head_sha를 직렬화해 해시한 값. CI가 동일 입력으로 재계산해 대조(완전성·불변성 보증).",
          "$ref": "#/$defs/sha256_hex"
        },
        "changed_paths_count": {
          "description": "이 PR이 실제로 변경한 문서 파일 수(전수). CI가 git diff로 대조.",
          "type": "integer",
          "minimum": 1
        }
      }
    }
  },
  "$defs": {
    "doc_path": {
      "description": "src/content/docs/{ko,en,ja} 하위의 .md/.mdx 경로. 제어문자·역슬래시·상위경로(..)·현재경로(./)·중복 슬래시·경로 끝 슬래시를 형식 단계에서 차단한다. 정규 상대경로 정규화 후 최종 검증은 trusted validator가 담당한다.",
      "type": "string",
      "maxLength": 512,
      "allOf": [
        { "pattern": "^src/content/docs/(ko|en|ja)/[^\\\\]+\\.mdx?$" },
        { "not": { "pattern": "(^|/)\\.\\.?(/|$)" } },
        { "not": { "pattern": "//" } },
        { "not": { "pattern": "[\\u0000-\\u001f\\u007f]" } }
      ]
    },
    "sha256_hex": {
      "description": "64자 소문자 SHA-256 16진.",
      "type": "string",
      "pattern": "^[0-9a-f]{64}$"
    },
    "claim": {
      "type": "object",
      "additionalProperties": false,
      "required": ["claim", "checked_at", "status"],
      "description": "source_url 또는 sources 중 최소 하나가 있어야 형식 통과. 둘 다 없으면 차단(trusted validator에서도 재확인).",
      "anyOf": [
        { "required": ["source_url"] },
        { "required": ["sources"] }
      ],
      "properties": {
        "claim": {
          "description": "변경되는 구체적 사실 주장.",
          "type": "string",
          "minLength": 1,
          "maxLength": 2048
        },
        "source_url": {
          "description": "단일 공식 출처 URL. 법규/규제 주장은 다중 출처(sources)를 사용한다.",
          "type": "string",
          "format": "uri",
          "pattern": "^https://",
          "maxLength": 2048
        },
        "sources": {
          "description": "법규/규제 주장용 다중 1차 출처 배열. source_url 대신 사용 가능. 상한 8개.",
          "type": "array",
          "minItems": 1,
          "maxItems": 8,
          "items": {
            "type": "object",
            "additionalProperties": false,
            "required": ["source_url"],
            "properties": {
              "source_url": {
                "type": "string",
                "format": "uri",
                "pattern": "^https://",
                "maxLength": 2048
              },
              "quote": { "type": "string", "maxLength": 2048 },
              "source_body_hash": { "$ref": "#/$defs/sha256_hex" },
              "source_body_chars": { "type": "integer", "minimum": 0 },
              "source_updated_at": { "type": "string", "maxLength": 64 }
            }
          }
        },
        "quote": {
          "description": "출처에서 발췌한 짧은 뒷받침 문구(리뷰 보조용, 독립 재확인을 대체하지 않음).",
          "type": "string",
          "maxLength": 2048
        },
        "checked_at": {
          "description": "우리가 출처를 확인한 시각(RFC 3339, timezone 필수). 미상 발행일 대신 오늘 날짜를 넣지 않는다. format:date-time은 draft 2020-12에서 비강제일 수 있어 pattern으로 timezone(Z 또는 ±HH:MM)을 강제한다.",
          "type": "string",
          "format": "date-time",
          "pattern": "^[0-9]{4}-[0-9]{2}-[0-9]{2}T[0-9]{2}:[0-9]{2}:[0-9]{2}(\\.[0-9]+)?(Z|[+-][0-9]{2}:[0-9]{2})$",
          "maxLength": 64
        },
        "source_updated_at": {
          "description": "발행자 측 갱신일. 불명이면 생략한다(오늘 날짜로 대체 금지).",
          "type": "string",
          "maxLength": 64
        },
        "source_body_hash": { "$ref": "#/$defs/sha256_hex" },
        "source_body_chars": {
          "type": "integer",
          "minimum": 0
        },
        "volatile": {
          "description": "가격·리전·한도 등 변동성 높은 사실 여부.",
          "type": "boolean"
        },
        "status": {
          "description": "주장 검증 상태. 자기신고 값이며, verified의 진위는 trusted validator가 독립 확인한다.",
          "type": "string",
          "enum": ["verified", "unverified", "conflicting"]
        }
      }
    }
  }
}
