{
  "schema_version": 1,
  "jira_key": "DOCS-283",
  "policy_action": "update",
  "tier_hint": "B",
  "tier_reasons": [
    "10월 AWS 공식 발표를 기존 관리형 RDB 문서에 반영하고 관리형 DB의 디스크 자동 확장 선택지를 명확히 한다."
  ],
  "target_path": "src/content/docs/ko/database/managed-rdb.md",
  "changed_paths": [
    "src/content/docs/ko/database/managed-rdb.md",
    "src/content/docs/en/database/managed-rdb.md",
    "src/content/docs/ja/database/managed-rdb.md"
  ],
  "generated_by_llm": true,
  "writer": {
    "model": "gpt-6",
    "provider": "openai"
  },
  "claim_ledger": [
    {
      "claim": "2026년 10월 RDS for Oracle과 SQL Server의 추가 스토리지 볼륨에도 최대 저장 용량을 설정해 자동 확장을 적용할 수 있게 되었다.",
      "source_url": "https://aws.amazon.com/about-aws/whats-new/2026/10/amazon-rds-oracle-sqlserver-autoscaling-additional-storage-volumes/",
      "quote": "now support RDS storage autoscaling on",
      "checked_at": "2026-10-31T22:12:56Z",
      "volatile": true,
      "status": "verified"
    }
  ]
}
