{
  "schema_version": 1,
  "jira_key": "DOCS-224",
  "policy_action": "update",
  "tier_hint": "B",
  "tier_reasons": [
    "stale 후보 스캐너(HIGH)가 japan/ai-landscape.md에서 '마커(2026-09)보다 과거/현재인데 미래형 예정'으로 서술된 겐나이 실증 일정 2건을 제보 → 현행화",
    "겐나이의 2026년도 대규모 실증 실시와 OSS 공개(2026-04-24)는 디지털청 공식 1차로 확인됨. 그러나 8월 평가환경 구축·9–11월 A/B 실증 등 세부 월별 일정은 공식 1차로 확정되지 않아 2차 보도 기반임을 명시하고 '예정' 단정을 제거(시점 중립화)",
    "국가별(일본) 규제·정책 경로 문서 — 사실 단정을 피하고 공식 확인 필요를 명시하는 보수적 서술로 조정"
  ],
  "target_path": "src/content/docs/ko/japan/ai-landscape.md",
  "changed_paths": [
    "src/content/docs/ko/japan/ai-landscape.md",
    "src/content/docs/en/japan/ai-landscape.md",
    "src/content/docs/ja/japan/ai-landscape.md"
  ],
  "generated_by_llm": true,
  "writer": {
    "model": "kiro-agent",
    "provider": "kiro"
  },
  "claim_ledger": [
    {
      "claim": "일본 디지털청(Digital Agency)은 생성AI 이용환경 '겐나이(源内)'에 대해 2026년도(令和8年度) 전 부처 약 18만 명 대상 대규모 실증을 실시하며, 2026년 4월 24일 겐나이 일부를 상용 이용 가능한 라이선스의 무상 OSS로 GitHub에 공개했다. (이 두 가지는 공식 1차로 확인됨.)",
      "source_url": "https://www.digital.go.jp/news/907c8e5d-2f4f-4bd7-9400-37c9f4221d7d",
      "quote": "令和8年度（2026年度）において、全府省庁の約18万人の政府職員を対象とした大規模実証を実施します … 源内の一部を商用利用可能なライセンスのもと、無償のオープンソースソフトウェア（OSS）として公開しました。公開開始日 令和8年（2026年）4月24日",
      "checked_at": "2026-10-25T19:30:00+09:00",
      "volatile": false,
      "status": "verified"
    },
    {
      "claim": "겐나이 국산 LLM 실증의 세부 월별 일정(2026년 8월 평가환경 구축, 2026년 9–11월 A/B 실증 실험 등)은 디지털청 공식 1차 발표로 완료 여부가 확정되지 않았다. 본문에서는 해당 일정을 2차 보도 기반으로 소개하되 '예정' 단정을 제거하고 공식 확인이 필요함을 명시한다. (과거/현재 시점이 미래형 '예정'으로 남아 있던 서술을 시점 중립화.)",
      "source_url": "https://www.digital.go.jp/news/907c8e5d-2f4f-4bd7-9400-37c9f4221d7d",
      "quote": "令和8年度（2026年度）において、全府省庁の約18万人の政府職員を対象とした大規模実証を実施します",
      "checked_at": "2026-10-25T19:30:00+09:00",
      "volatile": true,
      "status": "verified"
    }
  ]
}
